Действие;action;icon;Описание;Стоимость;Вероятность;Приз
Подстрекательство к бунту;sedition;mdi-fencing;Купец, недовольный политикой власти, подкупает народных вождей и подымает толпу на восстание;1500;8-20;Общественный порядок в выбранном регионе падает на 5 пунктов
Благотворительность;charity;mdi-charity;Купец на большой православный праздник решает раздать излишки хлеба сирым и убогим;2000;-;Общественный порядок в выбранном регионе повышается на 5 пунктов
Саботаж;sabotage;mdi-stop-circle;Подкуп иностранных партнеров по торговле, снабжающих обоз армии врага;4000;14-20;Паралич любой из армий противника в следующем ходу
Контрабанда;contraband;mdi-crosshairs-off;Взятка таможне наложившей эмбарго страны, с целью получения возможности контрабанды;1000;6-20;Доступ к рынку наложившей эмбарго страны в текущем году. Общий объем закупок/продаж не может превышать 5 000 рублей
Открыть ворота!;open_gate;mdi-gate-open;Купец договаривается с партнерами во вражеском городе, что в момент штурма они откроют ворота для штурмующих;5000;15-20;Штурм вражеского города можно вести без осадных орудий
Новые промыслы;new_fisheries;mdi-teddy-bear;Купец открывает новые промыслы пушнины в далеких и неосвоенных землях;2500;10-20;Купец единоразово получает 5000. Государственная казна получает 5000.
Народная поддержка;people_support;Mdi-hand-back-left-outline;Купеческая гильдия поднимает народ на поддержку сражающейся армии.;0;6-20;Сила выбранной армии +1
